{
  "$schema": "https://json-schema.org/draft/2020-12/schema",
  "title": "AnalysisModuleParsedRequirement",
  "type": "object",
  "required": [
    "objective",
    "actors",
    "entities",
    "preconditions",
    "actions",
    "expected_results",
    "constraints",
    "ambiguities"
  ],
  "properties": {
    "objective": {
      "type": "string"
    },
    "actors": {
      "type": "array",
      "items": {
        "type": "string"
      }
    },
    "entities": {
      "type": "array",
      "items": {
        "type": "string"
      }
    },
    "preconditions": {
      "type": "array",
      "items": {
        "type": "string"
      }
    },
    "actions": {
      "type": "array",
      "items": {
        "type": "string"
      }
    },
    "expected_results": {
      "type": "array",
      "items": {
        "type": "string"
      }
    },
    "constraints": {
      "type": "array",
      "items": {
        "type": "string"
      }
    },
    "ambiguities": {
      "type": "array",
      "items": {
        "type": "string"
      }
    },
    "source_chunks": {
      "type": "array",
      "items": {
        "type": "string"
      }
    }
  },
  "additionalProperties": true
}
