{
  "objective": "用户中心需求示例",
  "actors": [
    "普通用户",
    "用户"
  ],
  "entities": [
    "用户中心需求示例",
    "背景",
    "普通用户登录后进入用户中心页面",
    "展示要求",
    "页面应显示用户昵称和会员等级",
    "页面应显示最近订单入口",
    "操作要求",
    "用户点击“最近订单”后",
    "应跳转到订单列表页",
    "用户在搜索框输入订单号后"
  ],
  "preconditions": [
    "普通用户登录后进入用户中心页面",
    "未登录用户不能访问用户中心"
  ],
  "actions": [
    "用户点击“最近订单”后，应跳转到订单列表页",
    "用户在搜索框输入订单号后，应显示匹配的订单结果"
  ],
  "expected_results": [
    "页面应显示用户昵称和会员等级",
    "页面应显示最近订单入口",
    "搜索结果为空时应提示“未找到相关订单”"
  ],
  "constraints": [
    "未登录用户不能访问用户中心"
  ],
  "ambiguities": [],
  "source_chunks": [
    "chunk_003",
    "chunk_002",
    "chunk_001",
    "chunk_004"
  ]
}