{
  "objective": "用户打开首页后应看到搜索框和标题",
  "actors": [
    "用户"
  ],
  "entities": [
    "用户打开首页后应看到搜索框和标题"
  ],
  "preconditions": [],
  "actions": [
    "用户打开首页后应看到搜索框和标题"
  ],
  "expected_results": [
    "System returns an observable result aligned with the requirement"
  ],
  "constraints": [],
  "ambiguities": [],
  "source_chunks": [
    "chunk_001"
  ]
}